{
  "schema_version": 1,
  "qupath_version": "0.7.0",
  "declared_at": "2026-09-03",
  "localizations": [
    {
      "component_id": "qupath-core",
      "locale": "es",
      "revision": null,
      "source_of_truth": "versions/0.7.0/work/translation.tsv",
      "dist_bundle": "versions/0.7.0/dist/qupath-gui-strings_es.properties",
      "dist_sha256": "E4A966C90D1CE1368DE9EA21DECC7D9DBB0180087B60D3724690AAD4C128FC19",
      "translation_status": "TRANSLATED",
      "validation_status": "VALIDATED",
      "distribution_status": "DISTRIBUTED"
    },
    {
      "component_id": "dl-pixel-classifier",
      "locale": "es",
      "revision": "v0.8.5",
      "source_of_truth": "components/dl-pixel-classifier/l10n/v0.8.5/strings.tsv",
      "dist_bundle": "components/dl-pixel-classifier/l10n/v0.8.5/dist/strings_es.properties",
      "dist_sha256": "78926B65BC6864E9EE672B7603E0415D872340B75B01A478FBA5002770AD928B",
      "translation_status": "IN_PROGRESS",
      "validation_status": "NOT_VALIDATED",
      "distribution_status": "UNSUPPORTED"
    },
    {
      "component_id": "tiatoolbox",
      "locale": "es",
      "revision": null,
      "source_of_truth": null,
      "dist_bundle": null,
      "dist_sha256": null,
      "translation_status": "NOT_STARTED",
      "validation_status": "NOT_APPLICABLE",
      "distribution_status": "UNSUPPORTED"
    },
    {
      "component_id": "instanseg",
      "locale": "es",
      "revision": "v0.1.7",
      "source_of_truth": "components/instanseg/l10n/v0.1.7/strings.tsv",
      "dist_bundle": "components/instanseg/l10n/v0.1.7/dist/strings_es.properties",
      "dist_sha256": "D2405B02E4284BF5AA7F8C51EDB61E3C3B3364C064DC393E1B0D2C23C6E0E06A",
      "translation_status": "IN_PROGRESS",
      "validation_status": "NOT_VALIDATED",
      "distribution_status": "UNSUPPORTED"
    },
    {
      "component_id": "cell-analysis-tools",
      "locale": "es",
      "revision": null,
      "source_of_truth": null,
      "dist_bundle": null,
      "dist_sha256": null,
      "translation_status": "NOT_STARTED",
      "validation_status": "NOT_APPLICABLE",
      "distribution_status": "UNSUPPORTED"
    },
    {
      "component_id": "training",
      "locale": "es",
      "revision": null,
      "source_of_truth": null,
      "dist_bundle": null,
      "dist_sha256": null,
      "translation_status": "NOT_STARTED",
      "validation_status": "NOT_APPLICABLE",
      "distribution_status": "UNSUPPORTED"
    },
    {
      "component_id": "stardist",
      "locale": "es",
      "revision": null,
      "source_of_truth": null,
      "dist_bundle": null,
      "dist_sha256": null,
      "translation_status": "NOT_STARTED",
      "validation_status": "NOT_APPLICABLE",
      "distribution_status": "UNSUPPORTED"
    },
    {
      "component_id": "cellpose",
      "locale": "es",
      "revision": null,
      "source_of_truth": null,
      "dist_bundle": null,
      "dist_sha256": null,
      "translation_status": "NOT_STARTED",
      "validation_status": "NOT_APPLICABLE",
      "distribution_status": "UNSUPPORTED"
    },
    {
      "component_id": "wsinfer",
      "locale": "es",
      "revision": null,
      "source_of_truth": null,
      "dist_bundle": null,
      "dist_sha256": null,
      "translation_status": "NOT_STARTED",
      "validation_status": "NOT_APPLICABLE",
      "distribution_status": "UNSUPPORTED"
    },
    {
      "component_id": "djl",
      "locale": "es",
      "revision": null,
      "source_of_truth": null,
      "dist_bundle": null,
      "dist_sha256": null,
      "translation_status": "NOT_STARTED",
      "validation_status": "NOT_APPLICABLE",
      "distribution_status": "UNSUPPORTED"
    },
    {
      "component_id": "bioimageio",
      "locale": "es",
      "revision": null,
      "source_of_truth": null,
      "dist_bundle": null,
      "dist_sha256": null,
      "translation_status": "NOT_STARTED",
      "validation_status": "NOT_APPLICABLE",
      "distribution_status": "UNSUPPORTED"
    },
    {
      "component_id": "sam",
      "locale": "es",
      "revision": null,
      "source_of_truth": null,
      "dist_bundle": null,
      "dist_sha256": null,
      "translation_status": "NOT_STARTED",
      "validation_status": "NOT_APPLICABLE",
      "distribution_status": "UNSUPPORTED"
    },
    {
      "component_id": "image-export-toolkit",
      "locale": "es",
      "revision": null,
      "source_of_truth": null,
      "dist_bundle": null,
      "dist_sha256": null,
      "translation_status": "NOT_STARTED",
      "validation_status": "NOT_APPLICABLE",
      "distribution_status": "UNSUPPORTED"
    }
  ]
}
